{
  "schema_version": 1,
  "kind": "tool",
  "id": "buffer",
  "guide": "social/guides/buffer.md",
  "recheck_after_days": 7,
  "always_live_checks": [
    "Verify get_account, organization and channel identity; never copy a historical ID blindly.",
    "Inspect the current tool schema and current saved draft before a mutation.",
    "Keep saveToDraft=true and dueAt absent/null for draft preparation; default queue behaviour is not draft authority.",
    "Publication/scheduling needs the exact approved payload and the authorised go-live route.",
    "Independently reopen native saved state in Codex; API success alone is insufficient."
  ],
  "capabilities": [
    {
      "channel": "instagram",
      "format": "carousel",
      "status": "verified",
      "verified_at": "2026-10-26",
      "evidence_ref": ".scratch/channel-audit/first-carousel-experiment-20261026/fresh-owner/CLOSEOUT.md",
      "verified_operations": [
        "draft",
        "schedule",
        "publish"
      ]
    },
    {
      "channel": "instagram",
      "format": "single-image",
      "status": "unverified",
      "verified_at": null,
      "evidence_ref": "Not verified by this pilot; consult prior dated evidence and perform one bounded capability check.",
      "verified_operations": []
    },
    {
      "channel": "instagram",
      "format": "short-video",
      "status": "unverified",
      "verified_at": null,
      "evidence_ref": "Not verified by this pilot; consult prior dated evidence and perform one bounded capability check.",
      "verified_operations": []
    },
    {
      "channel": "linkedin",
      "format": "carousel",
      "status": "unverified",
      "verified_at": null,
      "evidence_ref": ".scratch/channel-audit/daily-20261027/shopping-agent-reader-flow-v3.md; stored PDF verified, saved Buffer preview incomplete; native LinkedIn unscheduled draft verified separately",
      "verified_operations": []
    },
    {
      "channel": "linkedin",
      "format": "single-image",
      "status": "verified",
      "verified_at": "2026-10-26",
      "evidence_ref": ".scratch/channel-audit/first-carousel-experiment-20261026/REVIEW.md",
      "verified_operations": [
        "draft"
      ]
    },
    {
      "channel": "linkedin",
      "format": "text",
      "status": "unverified",
      "verified_at": null,
      "evidence_ref": "Not verified by this pilot; consult prior dated evidence and perform one bounded capability check.",
      "verified_operations": []
    },
    {
      "channel": "linkedin",
      "format": "short-video",
      "status": "unverified",
      "verified_at": null,
      "evidence_ref": "Not verified by this pilot; consult prior dated evidence and perform one bounded capability check.",
      "verified_operations": []
    },
    {
      "channel": "x",
      "format": "single-image",
      "status": "verified",
      "verified_at": "2026-10-26",
      "evidence_ref": ".scratch/channel-audit/first-carousel-experiment-20261026/fresh-owner/CLOSEOUT.md",
      "verified_operations": [
        "draft",
        "publish"
      ]
    },
    {
      "channel": "x",
      "format": "text",
      "status": "unverified",
      "verified_at": null,
      "evidence_ref": "Not verified by this pilot; consult prior dated evidence and perform one bounded capability check.",
      "verified_operations": []
    },
    {
      "channel": "x",
      "format": "short-video",
      "status": "unverified",
      "verified_at": null,
      "evidence_ref": "Not verified by this pilot; consult prior dated evidence and perform one bounded capability check.",
      "verified_operations": []
    },
    {
      "channel": "tiktok",
      "format": "carousel",
      "status": "verified",
      "verified_at": "2026-10-26",
      "evidence_ref": ".scratch/channel-audit/first-carousel-experiment-20261026/fresh-owner/CLOSEOUT.md",
      "verified_operations": [
        "draft",
        "publish"
      ]
    },
    {
      "channel": "tiktok",
      "format": "short-video",
      "status": "unverified",
      "verified_at": null,
      "evidence_ref": "Not verified by this pilot; consult prior dated evidence and perform one bounded capability check.",
      "verified_operations": []
    },
    {
      "channel": "youtube",
      "format": "short-video",
      "status": "unverified",
      "verified_at": null,
      "evidence_ref": "Not verified by this pilot; consult prior dated evidence and perform one bounded capability check.",
      "verified_operations": []
    },
    {
      "channel": "substack",
      "format": "article",
      "status": "unverified",
      "verified_at": null,
      "evidence_ref": "Not verified by this pilot; consult prior dated evidence and perform one bounded capability check.",
      "verified_operations": []
    },
    {
      "channel": "facebook",
      "format": "carousel",
      "status": "verified",
      "verified_at": "2026-10-26",
      "evidence_ref": ".scratch/channel-audit/first-carousel-experiment-20261026/fresh-owner/CLOSEOUT.md",
      "verified_operations": [
        "draft",
        "schedule",
        "publish"
      ]
    },
    {
      "channel": "facebook",
      "format": "single-image",
      "status": "unverified",
      "verified_at": null,
      "evidence_ref": "Not verified in this pilot.",
      "verified_operations": []
    },
    {
      "channel": "facebook",
      "format": "short-video",
      "status": "unverified",
      "verified_at": null,
      "evidence_ref": "Not verified in this pilot.",
      "verified_operations": []
    },
    {
      "channel": "facebook",
      "format": "text",
      "status": "unverified",
      "verified_at": null,
      "evidence_ref": "Not verified in this pilot.",
      "verified_operations": []
    },
    {
      "channel": "instagram",
      "format": "story",
      "status": "verified",
      "verified_at": "2026-10-26",
      "verified_operations": [
        "draft",
        "publish"
      ],
      "evidence_ref": ".scratch/channel-audit/first-carousel-experiment-20261026/fresh-owner/CLOSEOUT.md"
    },
    {
      "channel": "facebook",
      "format": "story",
      "status": "verified",
      "verified_at": "2026-10-26",
      "verified_operations": [
        "draft",
        "publish"
      ],
      "evidence_ref": ".scratch/channel-audit/first-carousel-experiment-20261026/fresh-owner/CLOSEOUT.md"
    },
    {
      "channel": "threads",
      "format": "text",
      "status": "unverified",
      "verified_at": null,
      "evidence_ref": "Not verified. Buffer listed a Threads channel on 27 October 2026; no draft, schedule or publish has been tested.",
      "verified_operations": []
    },
    {
      "channel": "threads",
      "format": "single-image",
      "status": "unverified",
      "verified_at": null,
      "evidence_ref": "Not verified. Buffer listed a Threads channel on 27 October 2026; no draft, schedule or publish has been tested.",
      "verified_operations": []
    },
    {
      "channel": "substack-notes",
      "format": "note",
      "status": "unverified",
      "verified_at": null,
      "evidence_ref": "Not verified. Krish connected Substack in Buffer on 27 October 2026 (channel Krish, service substack); posting a Note has not been checked yet.",
      "verified_operations": []
    },
    {
      "channel": "instagram",
      "format": "meme",
      "status": "unverified",
      "verified_at": null,
      "evidence_ref": "Not verified for the meme format; perform one bounded capability check on the exact channel.",
      "verified_operations": []
    },
    {
      "channel": "facebook",
      "format": "meme",
      "status": "unverified",
      "verified_at": null,
      "evidence_ref": "Not verified for the meme format; perform one bounded capability check on the exact channel.",
      "verified_operations": []
    },
    {
      "channel": "tiktok",
      "format": "meme",
      "status": "unverified",
      "verified_at": null,
      "evidence_ref": "Not verified for the meme format; perform one bounded capability check on the exact channel.",
      "verified_operations": []
    },
    {
      "channel": "youtube",
      "format": "meme",
      "status": "unverified",
      "verified_at": null,
      "evidence_ref": "Not verified for the meme format; perform one bounded capability check on the exact channel.",
      "verified_operations": []
    },
    {
      "channel": "x",
      "format": "meme",
      "status": "unverified",
      "verified_at": null,
      "evidence_ref": "Not verified for the meme format; perform one bounded capability check on the exact channel.",
      "verified_operations": []
    },
    {
      "channel": "threads",
      "format": "meme",
      "status": "unverified",
      "verified_at": null,
      "evidence_ref": "Not verified. Buffer listed a Threads channel on 27 October 2026; no draft, schedule or publish has been tested.",
      "verified_operations": []
    }
  ],
  "lessons": [
    "revision-identity",
    "clipboard-image-upload",
    "file-chooser-handoff",
    "document-upload-unverified",
    "nullable-preview-clear",
    "publishing-authority-split",
    "schedule-full-payload",
    "tiktok-photo-disclosure",
    "facebook-native-check-held",
    "native-release-readback",
    "buffer-document-preview-hold"
  ]
}
